255,The Wolf of Wall Street,12/25/2013,180,R,"Based on the true story of Jordan Belfort, from his rise to a wealthy stock-broker living the high life to his fall involving crime, corruption and the federal government.",Standard
256,Blades of Glory,03/30/2007,93,PG-13,"In 2002, two rival Olympic ice skaters were stripped of their gold medals and permanently banned from men's single competition. Presently, however, they've found a loophole that will allow them to qualify as a pairs team.",Standard
257,Hot Tub Time Machine,03/26/2010,99,R,"A malfunctioning time machine at a ski resort takes a man back to 1986 with his two friends and nephew, where they must relive a fateful night and not change anything to make sure the nephew is born.",Standard
258,Wedding Crashers,07/15/2005,119,R,"John Beckwith and Jeremy Grey, a pair of committed womanizers who sneak into weddings to take advantage of the romantic tinge in the air, find themselves at odds with one another when John meets and falls for Claire Cleary.",Standard
259,30 Minutes or Less,08/12/2011,83,R,"Two fledgling criminals kidnap a pizza delivery guy, strap a bomb to his chest, and inform him that he has mere hours to rob a bank or else...",Standard
260,Get Hard,03/27/2015,100,R,"When millionaire James King is jailed for fraud and bound for San Quentin, he turns to Darnell Lewis to prep him to go behind bars.",Standard
261,Blade Runner,06/25/1982,117,R,"A blade runner must pursue and terminate four replicants who stole a ship in space, and have returned to Earth to find their creator.",Standard
262,District 9,08/14/2009,112,R,Violence ensues after an extraterrestrial race forced to live in slum-like conditions on Earth finds a kindred spirit in a government agent exposed to their biotechnology.,Standard
263,American Sniper,12/25/2014,132,R,"Navy S.E.A.L. sniper Chris Kyle's pinpoint accuracy saves countless lives on the battlefield and turns him into a legend. Back home with his family after four tours of duty, however, Chris finds that it is the war he can't leave behind.",Standard
264,Get Smart,06/20/2008,110,PG-13,"Maxwell Smart, a highly intellectual but bumbling spy working for the CONTROL agency, is tasked with preventing a terrorist attack from rival spy agency KAOS.",Standard
265,Yes Man,12/19/2008,104,PG-13,"A man challenges himself to say ""yes"" to everything.",Standard
266,Argo,10/12/2012,120,R,"Acting under the cover of a Hollywood producer scouting a location for a science fiction film, a CIA agent launches a dangerous operation to rescue six Americans in Tehran during the U.S. hostage crisis in Iran in 1979.",Standard
267,Mr. Deeds,06/28/2008,96,PG-13,"A sweet-natured, small-town guy inherits a controlling stake in a media conglomerate and begins to do business his way.",Standard
268,Freaky Friday,08/06/2003,96,PG,"An overworked mother and her daughter do not get along. When they switch bodies, each is forced to adapt to the other's life for one freaky Friday.",Standard
269,Spy Kids 3: Game Over,07/25/2003,84,PG,"Carmen's caught in a virtual reality game designed by the Kids' new nemesis, the Toymaker. It's up to Juni to save his sister, and ultimately the world.",Standard
270,Like Mike,07/03/2002,99,PG,"A 13-year-old orphan becomes an NBA superstar after trying on a pair of sneakers with the faded initials ""M.J."" inside.",Standard
271,Miss March,03/13/2009,90,R,"Eugene believes in no sex before marriage. So DID his girlfriend, Cindi. His BFF loves sex. At Senior Prom, just before sex with Cindi, he falls into a coma. Waking up 4 years later, his Cindi is Miss March in Playboy. Can he get her back?",Standard
272,Grudge Match,12/25/2013,113,PG-13,"A pair of aging boxing rivals are coaxed out of retirement to fight one final bout, thirty years after their last match.",Standard
273,Let’s Be Cops,08/13/2014,104,R,"Two struggling pals dress as police officers for a costume party and become neighborhood sensations. But when these newly-minted ""heroes"" get tangled in a real life web of mobsters and dirty detectives, they must put their fake badges on the line.",Standard
274,Pixels,07/24/2015,106,PG-13,"When aliens misinterpret video feeds of classic arcade games as a declaration of war, they attack the Earth in the form of the video games.",Standard
275,Accepted,08/18/2006,92,PG-13,"A high school slacker who's rejected by every school he applies to opts to create his own institution of higher learning, the South Harmon Institute of Technology, on a rundown piece of property near his hometown.",Standard
276,The Incredibles,11/05/2004,115,PG,"A family of undercover superheroes, while trying to live the quiet suburban life, are forced into action to save the world.",Standard
277,Unaccompanied Minors,12/08/2006,87,PG,A group of unaccompanied minors bond while snowed in at the midwestern Hoover International Airport during the holiday season and ultimately create a makeshift holiday themselves.,Standard
278,Agent Cody Banks,03/14/2003,102,PG,A government agent trains Cody Banks in the ways of covert operations that require younger participants.,Standard
279,Remember the Titans,09/29/2000,113,PG,The true story of a newly appointed African-American coach and his high school team on their first season as a racially integrated unit.,Standard
280,The DaVinci Code,05/19/2006,149,PG-13,"A murder inside the Louvre, and clues in Da Vinci paintings, lead to the discovery of a religious mystery protected by a secret society for two thousand years, which could shake the foundations of Christianity.",Standard
281,The Mummy,05/07/1999,125,PG-13,"At an archaeological dig in the ancient city of Hamunaptra, an American serving in the French Foreign Legion accidentally awakens a mummy who begins to wreak havoc as he searches for the reincarnation of his long-lost love.",Standard
282,American Wedding,08/01/2003,96,R,"It's the wedding of Jim and Michelle and the gathering of their families and friends, including Jim's old friends from high school and Michelle's little sister.",Standard
283,Youth in Revolt,01/08/2010,89,R,"While his trailer trash parents teeter on the edge of divorce, Nick Twisp sets his sights on dream girl Sheeni Saunders, hoping that she'll be the one to take away his virginity",Standard
284,Up in the Air,12/04/2009,109,R,"Ryan Bingham enjoys living out of a suitcase for his job, travelling around the country firing people, but finds that lifestyle threatened by the presence of a potential love interest, and a new hire presenting a new business model.",Standard
285,As Good as It Gets,12/25/1997,139,PG-13,"A single mother and waitress, a misanthropic author, and a gay artist form an unlikely friendship after the artist is assaulted in a robbery.",Standard
286,A Beautiful Day in the Neighborhood,11/22/2019,109,PG,Based on the true story of a real-life friendship between Fred Rogers and journalist Lloyd Vogel.,Standard
287,The Dictator,05/16/2012,83,R,The heroic story of a dictator who risked his life to ensure that democracy would never come to the country he so lovingly oppressed.,Standard
